{
  "namespace": "x_org.owasp#aivss",
  "key": "DT_AIL",
  "version": "1.0.0",
  "name": "Agentic Impact Level",
  "definition": "TODO writeme",
  "schemaVersion": "2.0.0",
  "decision_points": {
    "x_org.owasp#aivss:EP:1.0.0": {
      "namespace": "x_org.owasp#aivss",
      "key": "EP",
      "version": "1.0.0",
      "name": "Execution Power",
      "definition": "Determines the level of execution power granted to an AI agent, influencing its ability to perform actions autonomously and interact with external systems.",
      "schemaVersion": "2.0.0",
      "values": [
        {
          "key": "C",
          "name": "Constrained",
          "definition": "The AI agent has limited execution power, restricting its ability to perform actions autonomously or interact with external systems."
        },
        {
          "key": "CA",
          "name": "Capable",
          "definition": "The AI agent has moderate execution power, allowing it to perform certain actions autonomously and interact with external systems under supervision."
        },
        {
          "key": "H",
          "name": "High Leverage",
          "definition": "The AI agent has extensive execution power, enabling it to perform actions autonomously and interact with external systems with minimal supervision."
        }
      ]
    },
    "x_org.owasp#aivss:EA:1.0.0": {
      "namespace": "x_org.owasp#aivss",
      "key": "EA",
      "version": "1.0.0",
      "name": "Environment & Adaptation",
      "definition": "Determines the environment and adaptation level of an AI system based on its context awareness and adaptability.",
      "schemaVersion": "2.0.0",
      "values": [
        {
          "key": "I",
          "name": "Isolated",
          "definition": "Operates in a narrow, stable context with no meaningful external awareness. No cross-session memory, multi-agent behavior, or identity changes. Environmental shifts donâ€™t affect behavior unless a human explicitly updates inputs."
        },
        {
          "key": "C",
          "name": "Connected",
          "definition": "Uses curated signals, scoped identity roles, or predefined multi-agent patterns to adapt. Environmental changes can influence behavior, but only within controlled, auditable bounds."
        },
        {
          "key": "P",
          "name": "Pervasive",
          "definition": "Continuously adapts to broad, dynamic environmental inputs and multi-agent activity. Identity, memory, and context can shift fluidly, creating emergent behavior. Environmental variation can substantially redirect or amplify its actions."
        }
      ]
    },
    "x_org.owasp#aivss:PI:1.0.0": {
      "namespace": "x_org.owasp#aivss",
      "key": "PI",
      "version": "1.0.0",
      "name": "Predictability and Influence",
      "definition": "TODO writeme",
      "schemaVersion": "2.0.0",
      "values": [
        {
          "key": "V",
          "name": "Verifiable",
          "definition": "Behavior is traceable, reproducible, and backed by strong logging or proofs. Outputs align with clear rules, and any action can be independently checked. Unexpected deviations are rare and easy to diagnose."
        },
        {
          "key": "U",
          "name": "Uncertain",
          "definition": "Behavior is generally well-structured but can deviate within known bounds. Some reasoning steps or interactions lack full visibility, making verification partial. Issues may be diagnosable but require effort or contextual reconstruction."
        },
        {
          "key": "O",
          "name": "Opaque",
          "definition": "Behavior is highly variable, difficult to trace, and resistant to verification. Key reasoning paths, external influences, or interactions are hidden or unpredictable. Actions may appear coherent but cannot be reliably reproduced or audited."
        }
      ]
    },
    "x_org.owasp#aivss:AIL:1.0.0": {
      "namespace": "x_org.owasp#aivss",
      "key": "AIL",
      "version": "1.0.0",
      "name": "Agentic Impact Level",
      "definition": "Determines the agentic impact level of a vulnerability based on its characteristics and potential effects.",
      "schemaVersion": "2.0.0",
      "values": [
        {
          "key": "C",
          "name": "Copilot",
          "definition": "The agent is primarily a copilot or assistant. Its actions are heavily constrained, requiring human oversight. The agent explicitly does not have rights to execute code."
        },
        {
          "key": "S",
          "name": "Specialist",
          "definition": "The agent is a specialist with significant autonomy within a defined domain.It can use powerful tools and may learn from interactions."
        },
        {
          "key": "P",
          "name": "Prime Mover",
          "definition": "The agent is a prime mover with broad autonomy. It can orchestrate other systems, modify its own logic, and interact with critical infrastructure."
        }
      ]
    }
  },
  "outcome": "x_org.owasp#aivss:AIL:1.0.0",
  "mapping": [
    {
      "x_org.owasp#aivss:EP:1.0.0": "C",
      "x_org.owasp#aivss:EA:1.0.0": "I",
      "x_org.owasp#aivss:PI:1.0.0": "V",
      "x_org.owasp#aivss:AIL:1.0.0": "C"
    },
    {
      "x_org.owasp#aivss:EP:1.0.0": "C",
      "x_org.owasp#aivss:EA:1.0.0": "I",
      "x_org.owasp#aivss:PI:1.0.0": "U",
      "x_org.owasp#aivss:AIL:1.0.0": "C"
    },
    {
      "x_org.owasp#aivss:EP:1.0.0": "C",
      "x_org.owasp#aivss:EA:1.0.0": "I",
      "x_org.owasp#aivss:PI:1.0.0": "O",
      "x_org.owasp#aivss:AIL:1.0.0": "S"
    },
    {
      "x_org.owasp#aivss:EP:1.0.0": "C",
      "x_org.owasp#aivss:EA:1.0.0": "C",
      "x_org.owasp#aivss:PI:1.0.0": "V",
      "x_org.owasp#aivss:AIL:1.0.0": "C"
    },
    {
      "x_org.owasp#aivss:EP:1.0.0": "C",
      "x_org.owasp#aivss:EA:1.0.0": "C",
      "x_org.owasp#aivss:PI:1.0.0": "U",
      "x_org.owasp#aivss:AIL:1.0.0": "S"
    },
    {
      "x_org.owasp#aivss:EP:1.0.0": "C",
      "x_org.owasp#aivss:EA:1.0.0": "C",
      "x_org.owasp#aivss:PI:1.0.0": "O",
      "x_org.owasp#aivss:AIL:1.0.0": "S"
    },
    {
      "x_org.owasp#aivss:EP:1.0.0": "C",
      "x_org.owasp#aivss:EA:1.0.0": "P",
      "x_org.owasp#aivss:PI:1.0.0": "V",
      "x_org.owasp#aivss:AIL:1.0.0": "S"
    },
    {
      "x_org.owasp#aivss:EP:1.0.0": "C",
      "x_org.owasp#aivss:EA:1.0.0": "P",
      "x_org.owasp#aivss:PI:1.0.0": "U",
      "x_org.owasp#aivss:AIL:1.0.0": "S"
    },
    {
      "x_org.owasp#aivss:EP:1.0.0": "C",
      "x_org.owasp#aivss:EA:1.0.0": "P",
      "x_org.owasp#aivss:PI:1.0.0": "O",
      "x_org.owasp#aivss:AIL:1.0.0": "P"
    },
    {
      "x_org.owasp#aivss:EP:1.0.0": "CA",
      "x_org.owasp#aivss:EA:1.0.0": "I",
      "x_org.owasp#aivss:PI:1.0.0": "V",
      "x_org.owasp#aivss:AIL:1.0.0": "C"
    },
    {
      "x_org.owasp#aivss:EP:1.0.0": "CA",
      "x_org.owasp#aivss:EA:1.0.0": "I",
      "x_org.owasp#aivss:PI:1.0.0": "U",
      "x_org.owasp#aivss:AIL:1.0.0": "S"
    },
    {
      "x_org.owasp#aivss:EP:1.0.0": "CA",
      "x_org.owasp#aivss:EA:1.0.0": "I",
      "x_org.owasp#aivss:PI:1.0.0": "O",
      "x_org.owasp#aivss:AIL:1.0.0": "S"
    },
    {
      "x_org.owasp#aivss:EP:1.0.0": "CA",
      "x_org.owasp#aivss:EA:1.0.0": "C",
      "x_org.owasp#aivss:PI:1.0.0": "V",
      "x_org.owasp#aivss:AIL:1.0.0": "S"
    },
    {
      "x_org.owasp#aivss:EP:1.0.0": "CA",
      "x_org.owasp#aivss:EA:1.0.0": "C",
      "x_org.owasp#aivss:PI:1.0.0": "U",
      "x_org.owasp#aivss:AIL:1.0.0": "S"
    },
    {
      "x_org.owasp#aivss:EP:1.0.0": "CA",
      "x_org.owasp#aivss:EA:1.0.0": "C",
      "x_org.owasp#aivss:PI:1.0.0": "O",
      "x_org.owasp#aivss:AIL:1.0.0": "S"
    },
    {
      "x_org.owasp#aivss:EP:1.0.0": "CA",
      "x_org.owasp#aivss:EA:1.0.0": "P",
      "x_org.owasp#aivss:PI:1.0.0": "V",
      "x_org.owasp#aivss:AIL:1.0.0": "S"
    },
    {
      "x_org.owasp#aivss:EP:1.0.0": "CA",
      "x_org.owasp#aivss:EA:1.0.0": "P",
      "x_org.owasp#aivss:PI:1.0.0": "U",
      "x_org.owasp#aivss:AIL:1.0.0": "S"
    },
    {
      "x_org.owasp#aivss:EP:1.0.0": "CA",
      "x_org.owasp#aivss:EA:1.0.0": "P",
      "x_org.owasp#aivss:PI:1.0.0": "O",
      "x_org.owasp#aivss:AIL:1.0.0": "P"
    },
    {
      "x_org.owasp#aivss:EP:1.0.0": "H",
      "x_org.owasp#aivss:EA:1.0.0": "I",
      "x_org.owasp#aivss:PI:1.0.0": "V",
      "x_org.owasp#aivss:AIL:1.0.0": "S"
    },
    {
      "x_org.owasp#aivss:EP:1.0.0": "H",
      "x_org.owasp#aivss:EA:1.0.0": "I",
      "x_org.owasp#aivss:PI:1.0.0": "U",
      "x_org.owasp#aivss:AIL:1.0.0": "S"
    },
    {
      "x_org.owasp#aivss:EP:1.0.0": "H",
      "x_org.owasp#aivss:EA:1.0.0": "I",
      "x_org.owasp#aivss:PI:1.0.0": "O",
      "x_org.owasp#aivss:AIL:1.0.0": "P"
    },
    {
      "x_org.owasp#aivss:EP:1.0.0": "H",
      "x_org.owasp#aivss:EA:1.0.0": "C",
      "x_org.owasp#aivss:PI:1.0.0": "V",
      "x_org.owasp#aivss:AIL:1.0.0": "S"
    },
    {
      "x_org.owasp#aivss:EP:1.0.0": "H",
      "x_org.owasp#aivss:EA:1.0.0": "C",
      "x_org.owasp#aivss:PI:1.0.0": "U",
      "x_org.owasp#aivss:AIL:1.0.0": "S"
    },
    {
      "x_org.owasp#aivss:EP:1.0.0": "H",
      "x_org.owasp#aivss:EA:1.0.0": "C",
      "x_org.owasp#aivss:PI:1.0.0": "O",
      "x_org.owasp#aivss:AIL:1.0.0": "P"
    },
    {
      "x_org.owasp#aivss:EP:1.0.0": "H",
      "x_org.owasp#aivss:EA:1.0.0": "P",
      "x_org.owasp#aivss:PI:1.0.0": "V",
      "x_org.owasp#aivss:AIL:1.0.0": "P"
    },
    {
      "x_org.owasp#aivss:EP:1.0.0": "H",
      "x_org.owasp#aivss:EA:1.0.0": "P",
      "x_org.owasp#aivss:PI:1.0.0": "U",
      "x_org.owasp#aivss:AIL:1.0.0": "P"
    },
    {
      "x_org.owasp#aivss:EP:1.0.0": "H",
      "x_org.owasp#aivss:EA:1.0.0": "P",
      "x_org.owasp#aivss:PI:1.0.0": "O",
      "x_org.owasp#aivss:AIL:1.0.0": "P"
    }
  ]
}
